2024-07-22	First Geet.  Geets are like Tweets but simple lines in text files
2024-07-22	Just using ISO-8601 dates for roughly day resolution.<br/>Any further resolution and permalinking can be obtained from Github.
2024-07-23	Testing auto-deploy while running Makefile 👌
2024-07-24	<a href='https://www.newyorker.com/culture/infinite-scroll/the-revenge-of-the-home-page'>The revenge of the home page</a>
2024-07-24	Nice to have a page that is simple but can be very custom.
2024-07-25	Added vimrc to header!  Why?  Because I use Vim literally everywhere.
2024-07-25	Adding text extraction to <a href='https://tinyurl.com/ubercut'>this</a> is game changing.
2024-07-25	Revisiting topics I want to cultivate is as easy as <code>grep  'cultivate, ' Log/*.md</code>. Thanks to plain text.
